{
  "schema": "design-tokens.v1",
  "themeId": "gripe-dark-default",
  "extends": "base",
  "brand": {
    "fontSans": "system-ui, -apple-system, BlinkMacSystemFont, 'Segoe UI', sans-serif",
    "primaryRgb": "245 158 11",
    "primaryForegroundRgb": "17 17 17",
    "bgRgb": "30 30 30",
    "surfaceRgb": "37 37 38",
    "borderRgb": "60 60 60",
    "mutedRgb": "157 157 157",
    "scrollbarTrack": "#1e1e1e",
    "scrollbarThumb": "rgba(255, 255, 255, 0.22)",
    "scrollbarThumbHover": "rgba(255, 255, 255, 0.34)"
  },
  "ui": {
    "accentRgb": "245 158 11",
    "accentHoverRgb": "217 119 6",
    "accentActiveRgb": "180 83 9",
    "accentForegroundRgb": "17 17 17",
    "linkRgb": "245 158 11",
    "linkHoverRgb": "251 191 36",
    "linkActiveRgb": "217 119 6",
    "textRgb": "212 212 212",
    "mutedRgb": "157 157 157",
    "surfaceRgb": "37 37 38",
    "surfaceMutedRgb": "45 45 48",
    "surfaceHoverRgb": "45 45 48",
    "controlBgRgb": "45 45 48",
    "controlBgHoverRgb": "60 60 60",
    "controlCheckedRgb": "245 158 11",
    "controlCheckedForegroundRgb": "17 17 17",
    "focusRingRgb": "245 158 11",
    "dangerRgb": "241 76 76",
    "ctaRgb": "245 158 11",
    "ctaHoverRgb": "217 119 6",
    "ctaActiveRgb": "180 83 9",
    "ctaForegroundRgb": "17 17 17",
    "ratingActiveRgb": "245 158 11",
    "radiusCard": "0.5rem",
    "radiusModal": "0.5rem",
    "radiusControlLg": "0.5rem",
    "radiusControl": "0.375rem",
    "radiusControlSm": "0.25rem"
  }
}
